{
  "id": "kz.volkus-02",
  "name": "Volkus Foundry Yard",
  "size": { "x": 30, "z": 22 },
  "pieces": [
    {
      "id": "p01",
      "model": "t-large-ruin",
      "pos": { "x": -5, "z": -1.25 },
      "yaw": 270,
      "parts": [
        {
          "id": "upper-floor",
          "footprint": [{ "x": -3, "z": -4.25 }, { "x": -3, "z": 1.75 }, { "x": -7, "z": 1.75 }, { "x": -7, "z": -4.25 }],
          "height": 3,
          "vantageFloors": [3],
          "traits": ["vantage", "ceiling"]
        },
        {
          "id": "wall-back",
          "footprint": [
            { "x": -3, "z": -4.25 },
            { "x": -3, "z": 1.75 },
            { "x": -3.5, "z": 1.75 },
            { "x": -3.5, "z": -4.25 }
          ],
          "height": 3,
          "thickness": 0.5,
          "traits": ["heavy"]
        },
        {
          "id": "wall-left",
          "footprint": [
            { "x": -3.5, "z": -4.25 },
            { "x": -3.5, "z": -3.75 },
            { "x": -6.5, "z": -3.75 },
            { "x": -6.5, "z": -4.25 }
          ],
          "height": 3,
          "thickness": 0.5,
          "traits": ["heavy"]
        },
        {
          "id": "wall-right-a",
          "footprint": [
            { "x": -3.5, "z": 1.25 },
            { "x": -3.5, "z": 1.75 },
            { "x": -4.25, "z": 1.75 },
            { "x": -4.25, "z": 1.25 }
          ],
          "height": 3,
          "thickness": 0.5,
          "traits": ["heavy"]
        },
        {
          "id": "window",
          "footprint": [
            { "x": -4.25, "z": 1.25 },
            { "x": -4.25, "z": 1.75 },
            { "x": -5.75, "z": 1.75 },
            { "x": -5.75, "z": 1.25 }
          ],
          "height": 3,
          "thickness": 0.5,
          "traits": ["barred", "heavy"]
        },
        {
          "id": "wall-right-b",
          "footprint": [
            { "x": -5.75, "z": 1.25 },
            { "x": -5.75, "z": 1.75 },
            { "x": -6.5, "z": 1.75 },
            { "x": -6.5, "z": 1.25 }
          ],
          "height": 3,
          "thickness": 0.5,
          "traits": ["heavy"]
        },
        {
          "id": "wall-front-a",
          "footprint": [{ "x": -6.5, "z": -4.25 }, { "x": -6.5, "z": -2 }, { "x": -7, "z": -2 }, { "x": -7, "z": -4.25 }],
          "height": 3,
          "thickness": 0.5,
          "traits": ["heavy"]
        },
        {
          "id": "door",
          "footprint": [{ "x": -6.5, "z": -2 }, { "x": -6.5, "z": -0.5 }, { "x": -7, "z": -0.5 }, { "x": -7, "z": -2 }],
          "height": 2.5,
          "thickness": 0.5,
          "traits": ["accessible", "heavy"]
        },
        {
          "id": "wall-front-b",
          "footprint": [{ "x": -6.5, "z": -0.5 }, { "x": -6.5, "z": 1.75 }, { "x": -7, "z": 1.75 }, { "x": -7, "z": -0.5 }],
          "height": 3,
          "thickness": 0.5,
          "traits": ["heavy"]
        },
        {
          "id": "rampart",
          "footprint": [
            { "x": -3, "z": -4.25 },
            { "x": -3, "z": 1.75 },
            { "x": -3.5, "z": 1.75 },
            { "x": -3.5, "z": -4.25 }
          ],
          "height": 4,
          "thickness": 0.5,
          "traits": ["light"]
        }
      ]
    },
    {
      "id": "p02",
      "model": "t-large-ruin",
      "pos": { "x": 5, "z": 1.25 },
      "yaw": 90,
      "parts": [
        {
          "id": "upper-floor",
          "footprint": [{ "x": 3, "z": 4.25 }, { "x": 3, "z": -1.75 }, { "x": 7, "z": -1.75 }, { "x": 7, "z": 4.25 }],
          "height": 3,
          "vantageFloors": [3],
          "traits": ["vantage", "ceiling"]
        },
        {
          "id": "wall-back",
          "footprint": [{ "x": 3, "z": 4.25 }, { "x": 3, "z": -1.75 }, { "x": 3.5, "z": -1.75 }, { "x": 3.5, "z": 4.25 }],
          "height": 3,
          "thickness": 0.5,
          "traits": ["heavy"]
        },
        {
          "id": "wall-left",
          "footprint": [{ "x": 3.5, "z": 4.25 }, { "x": 3.5, "z": 3.75 }, { "x": 6.5, "z": 3.75 }, { "x": 6.5, "z": 4.25 }],
          "height": 3,
          "thickness": 0.5,
          "traits": ["heavy"]
        },
        {
          "id": "wall-right-a",
          "footprint": [
            { "x": 3.5, "z": -1.25 },
            { "x": 3.5, "z": -1.75 },
            { "x": 4.25, "z": -1.75 },
            { "x": 4.25, "z": -1.25 }
          ],
          "height": 3,
          "thickness": 0.5,
          "traits": ["heavy"]
        },
        {
          "id": "window",
          "footprint": [
            { "x": 4.25, "z": -1.25 },
            { "x": 4.25, "z": -1.75 },
            { "x": 5.75, "z": -1.75 },
            { "x": 5.75, "z": -1.25 }
          ],
          "height": 3,
          "thickness": 0.5,
          "traits": ["barred", "heavy"]
        },
        {
          "id": "wall-right-b",
          "footprint": [
            { "x": 5.75, "z": -1.25 },
            { "x": 5.75, "z": -1.75 },
            { "x": 6.5, "z": -1.75 },
            { "x": 6.5, "z": -1.25 }
          ],
          "height": 3,
          "thickness": 0.5,
          "traits": ["heavy"]
        },
        {
          "id": "wall-front-a",
          "footprint": [{ "x": 6.5, "z": 4.25 }, { "x": 6.5, "z": 2 }, { "x": 7, "z": 2 }, { "x": 7, "z": 4.25 }],
          "height": 3,
          "thickness": 0.5,
          "traits": ["heavy"]
        },
        {
          "id": "door",
          "footprint": [{ "x": 6.5, "z": 2 }, { "x": 6.5, "z": 0.5 }, { "x": 7, "z": 0.5 }, { "x": 7, "z": 2 }],
          "height": 2.5,
          "thickness": 0.5,
          "traits": ["accessible", "heavy"]
        },
        {
          "id": "wall-front-b",
          "footprint": [{ "x": 6.5, "z": 0.5 }, { "x": 6.5, "z": -1.75 }, { "x": 7, "z": -1.75 }, { "x": 7, "z": 0.5 }],
          "height": 3,
          "thickness": 0.5,
          "traits": ["heavy"]
        },
        {
          "id": "rampart",
          "footprint": [{ "x": 3, "z": 4.25 }, { "x": 3, "z": -1.75 }, { "x": 3.5, "z": -1.75 }, { "x": 3.5, "z": 4.25 }],
          "height": 4,
          "thickness": 0.5,
          "traits": ["light"]
        }
      ]
    },
    {
      "id": "p03",
      "model": "t-small-ruin",
      "pos": { "x": -13, "z": -3.75 },
      "yaw": 270,
      "parts": [
        {
          "id": "wall-back",
          "footprint": [
            { "x": -11.5, "z": -5.75 },
            { "x": -11.5, "z": -1.75 },
            { "x": -12, "z": -1.75 },
            { "x": -12, "z": -5.75 }
          ],
          "height": 2.5,
          "thickness": 0.5,
          "traits": ["heavy"]
        },
        {
          "id": "wall-left",
          "footprint": [
            { "x": -12, "z": -5.75 },
            { "x": -12, "z": -5.25 },
            { "x": -14.5, "z": -5.25 },
            { "x": -14.5, "z": -5.75 }
          ],
          "height": 2.5,
          "thickness": 0.5,
          "traits": ["heavy"]
        },
        {
          "id": "wall-right",
          "footprint": [
            { "x": -12, "z": -2.25 },
            { "x": -12, "z": -1.75 },
            { "x": -14.5, "z": -1.75 },
            { "x": -14.5, "z": -2.25 }
          ],
          "height": 2.5,
          "thickness": 0.5,
          "traits": ["heavy"]
        }
      ]
    },
    {
      "id": "p04",
      "model": "t-small-ruin",
      "pos": { "x": 13, "z": 3.75 },
      "yaw": 90,
      "parts": [
        {
          "id": "wall-back",
          "footprint": [{ "x": 11.5, "z": 5.75 }, { "x": 11.5, "z": 1.75 }, { "x": 12, "z": 1.75 }, { "x": 12, "z": 5.75 }],
          "height": 2.5,
          "thickness": 0.5,
          "traits": ["heavy"]
        },
        {
          "id": "wall-left",
          "footprint": [{ "x": 12, "z": 5.75 }, { "x": 12, "z": 5.25 }, { "x": 14.5, "z": 5.25 }, { "x": 14.5, "z": 5.75 }],
          "height": 2.5,
          "thickness": 0.5,
          "traits": ["heavy"]
        },
        {
          "id": "wall-right",
          "footprint": [{ "x": 12, "z": 2.25 }, { "x": 12, "z": 1.75 }, { "x": 14.5, "z": 1.75 }, { "x": 14.5, "z": 2.25 }],
          "height": 2.5,
          "thickness": 0.5,
          "traits": ["heavy"]
        }
      ]
    },
    {
      "id": "p05",
      "model": "t-container",
      "pos": { "x": -3.75, "z": 4 },
      "yaw": 0,
      "parts": [
        {
          "id": "container",
          "footprint": [
            { "x": -5.25, "z": 3.25 },
            { "x": -2.25, "z": 3.25 },
            { "x": -2.25, "z": 4.75 },
            { "x": -5.25, "z": 4.75 }
          ],
          "height": 2.5,
          "traits": ["heavy"]
        }
      ]
    },
    {
      "id": "p06",
      "model": "t-container",
      "pos": { "x": 3.75, "z": -4 },
      "yaw": 180,
      "parts": [
        {
          "id": "container",
          "footprint": [
            { "x": 5.25, "z": -3.25 },
            { "x": 2.25, "z": -3.25 },
            { "x": 2.25, "z": -4.75 },
            { "x": 5.25, "z": -4.75 }
          ],
          "height": 2.5,
          "traits": ["heavy"]
        }
      ]
    },
    {
      "id": "p07",
      "model": "t-container",
      "pos": { "x": -13, "z": 4.5 },
      "yaw": 0,
      "parts": [
        {
          "id": "container",
          "footprint": [
            { "x": -14.5, "z": 3.75 },
            { "x": -11.5, "z": 3.75 },
            { "x": -11.5, "z": 5.25 },
            { "x": -14.5, "z": 5.25 }
          ],
          "height": 2.5,
          "traits": ["heavy"]
        }
      ]
    },
    {
      "id": "p08",
      "model": "t-container",
      "pos": { "x": 13, "z": -4.5 },
      "yaw": 180,
      "parts": [
        {
          "id": "container",
          "footprint": [
            { "x": 14.5, "z": -3.75 },
            { "x": 11.5, "z": -3.75 },
            { "x": 11.5, "z": -5.25 },
            { "x": 14.5, "z": -5.25 }
          ],
          "height": 2.5,
          "traits": ["heavy"]
        }
      ]
    },
    {
      "id": "p09",
      "model": "t-pipes",